{
  "contract_family": "status-result",
  "contract_version": "v0.2",
  "request_ref": "request-placeholder-001",
  "result_ref": "result-placeholder-001",
  "state": "completed",
  "verification": {
    "scheme": "sha-256",
    "canonicalization": "rfc8785",
    "value": "b23ee84851b9f2a944e323095748678a15a4bbd649539a2890a3c1783ea3186a"
  },
  "completed_at": "2026-08-14T09:10:00Z",
  "request_verification": {
    "scheme": "sha-256",
    "canonicalization": "rfc8785",
    "value": "628eddd7daa50c7cb7d30c8b41120e6f5e6accd6a5e9b8cc09fb93174999061e"
  }
}
