{
  "contract_family": "status-result",
  "contract_version": "v0.2",
  "request_ref": "request-placeholder-002",
  "result_ref": "result-placeholder-002",
  "state": "denied",
  "verification": {
    "scheme": "sha-256",
    "canonicalization": "rfc8785",
    "value": "73ab035468270320ab409d7d172f003b90eb2db76fd40177780df562ae2fed72"
  },
  "request_verification": {
    "scheme": "sha-256",
    "canonicalization": "rfc8785",
    "value": "085d2634b36a07e9464e80fe3720f2351eaec24e284697e98fa71ae45ca4a3bf"
  }
}
