{
  "contract_family": "status-result",
  "contract_version": "v0.2",
  "request_ref": "request-placeholder-001",
  "result_ref": "result-placeholder-001",
  "state": "pending",
  "verification": {
    "scheme": "sha-256",
    "canonicalization": "rfc8785",
    "value": "17b79032b9faee78504fa209cac09f69b3ea4454080071269673c3fdbd4b2e95"
  },
  "request_verification": {
    "scheme": "sha-256",
    "canonicalization": "rfc8785",
    "value": "628eddd7daa50c7cb7d30c8b41120e6f5e6accd6a5e9b8cc09fb93174999061e"
  }
}
